{
  "layer_id": "mendelian_c6e37713_wg_v1",
  "layer_type": "mendelian_result",
  "schema_version": "mendelian_result_v1",
  "stage": "normalized",
  "dataset_id": "main_226_hatchery",
  "coordinate": null,
  "sample_scope": {
    "sample_ids": [
      "CGA042",
      "CGA189",
      "CGA192",
      "CGA204"
    ]
  },
  "source_files": [],
  "provenance": {
    "action_id": "act_1715000220000_v01",
    "engine": "mendelian",
    "engine_version": "v1.2.0",
    "config_hash": "sha256:0815f89a1edc106d19f57d019a2845d965c5e8ab8b0e37514108023a841c5dc5"
  },
  "status": "active",
  "created_at": "2026-05-11T15:42:00Z",
  "payload": {
    "_stub": true,
    "note": "synthetic payload for inventory demo"
  }
}